ID,Date,Tweet,Reply_count,Retweet_count,Like_count
1323409554567094272,2020-11-02 23:40:00+00:00,"Donald Trump is the most corrupt president in modern history.

Donald Trump is the most racist president in modern history.

Donald Trump is the worst jobs president in modern history.

Why would we give him another four years?",18961,31847,207292
1323404521523982338,2020-11-02 23:20:00+00:00,"The power to change this country is in your hands.

Vote: https://t.co/eoxT07uII9 https://t.co/fwxrJWjs7U",1630,3452,19379
1323400746939883522,2020-11-02 23:05:00+00:00,"Here’s the truth: Donald Trump inherited a growing economy from President Obama and me. And just like everything else he’s inherited in life, he squandered it.",11611,34213,260334
1323391493885718528,2020-11-02 22:28:14+00:00,I’m speaking with members of the African American community in Pittsburgh about the power of the vote — and the future we can build together. Tune in. https://t.co/1wFBiLoCWu,1538,1896,13395
1323383130435260419,2020-11-02 21:55:00+00:00,"When America votes, America will be heard. And when America is heard, I believe the message is going to be loud and clear: It’s time for Donald Trump to leave the White House.",5853,16643,141492
1323376838874484738,2020-11-02 21:30:00+00:00,"A Biden-Harris administration will:

- Implement nationwide mask mandates
- Ensure access to regular, reliable, and free testing
- Accelerate the development and distribution of safe and effective treatments and vaccines

We won’t waste any time getting this virus under control.",3480,7097,58707
1323373064277680128,2020-11-02 21:15:00+00:00,"Health care. 
Civil rights.
Climate change. 
Economic inequality. 
Racial justice.
The Supreme Court.
Our democracy.

They’re all at stake. Vote. https://t.co/eoxT07d7QB",1633,4289,27201
1323369292499484684,2020-11-02 21:00:01+00:00,"Together, we're going to rebuild our economy. And when we do, we'll not only build it back — we'll build it back better.",3845,7541,82371
1323365514400464897,2020-11-02 20:45:00+00:00,"You have the power to own the outcome of this election and determine the course of our country for generations to come.

Make your plan to vote: https://t.co/uoiVh9ZqzI https://t.co/RG2iIIEyWs",1367,2537,19834
1323362494753075201,2020-11-02 20:33:00+00:00,"It’s go time, America.

https://t.co/eoxT07uII9 https://t.co/5Hxi1E8CVe",1778,5609,27785
1323357964737089540,2020-11-02 20:15:00+00:00,"In public, President Trump compared COVID-19 to the flu and suggested people inject bleach to treat it.

In private, he told Bob Woodward it was deadlier than the flu and that he wanted to downplay it.

It’s unthinkable.",2801,9073,64434
1323354189876125696,2020-11-02 20:00:00+00:00,"I have always believed you can define America in one word: possibilities. And I refuse to postpone those possibilities any longer.

There is so much we can achieve as a nation with Donald Trump out of the White House.",2067,6153,51491
1323345575526297600,2020-11-02 19:25:46+00:00,"I'm in Beaver County, Pennsylvania, to thank some of our incredible volunteers for all their hard work. Tune in — and then sign up to help: https://t.co/VUXqFt8uvT https://t.co/iufd7btpcO",1143,1778,12567
1323344123873710081,2020-11-02 19:20:00+00:00,"Are you still undecided about who to vote for or know someone who is? My team put together some cheat sheets to show where Donald Trump and I stand on the issues to help you out. Take a look, and then share them with family and friends. https://t.co/DyTRJ38XPT",3569,20379,68384
1323340422794645505,2020-11-02 19:05:17+00:00,"We only get one opportunity to vote out Donald Trump — and we can’t leave anything to chance.

Vote: https://t.co/eoxT07d7QB
Volunteer: https://t.co/WSKsQEip4U
Donate: https://t.co/FGzADMacLc

Let’s get the job done.",1595,4080,26593
1323336825306402816,2020-11-02 18:51:00+00:00,"Mask up and vote.

https://t.co/eoxT07uII9 https://t.co/Z1gz3AkbgW",3966,15204,110439
1323326718426320899,2020-11-02 18:10:50+00:00,Tune in as my campaign manager @jomalleydillon and campaign adviser Bob Bauer discuss what to expect on Election Night. https://t.co/5E8k22TbOG,1052,1330,8078
1323320216038776832,2020-11-02 17:45:00+00:00,"We have one shot. One opportunity. One moment.

Don’t miss the chance — vote. https://t.co/6khzdLyIjL",6232,37252,172275
1323317447823273985,2020-11-02 17:34:00+00:00,"Tomorrow, the American people get their say and will choose the next President. This afternoon, my campaign manager @jomalleydillon and campaign adviser Bob Bauer will sit down to discuss what you can expect as the results come in. You can watch right here on Twitter at 1 PM ET. https://t.co/FAEpxUJs4s",1027,1658,12296
1323306919461756930,2020-11-02 16:52:10+00:00,One day left — and we're leaving it all on the field. Tune in as we get out the vote in Cleveland. https://t.co/GM62WxKTIc,1911,2222,14790
1323299670580449281,2020-11-02 16:23:21+00:00,"We’re just one day away from the most important election of our lifetimes — and we need your help to get voters to the polls.

Sign up to volunteer today: https://t.co/WSKsQEip4U",1766,3741,29214
1323297566726017024,2020-11-02 16:15:00+00:00,"Climate change isn't a hoax –– it's a threat to millions of Americans like Velma and Amirah.

We have to vote out Donald Trump tomorrow and take urgent action to combat this crisis. https://t.co/Lg9fvFlVg9",1252,2872,17484
1323291275613757442,2020-11-02 15:50:00+00:00,This is my commitment to you: We will make sure every American has access to a free and safe COVID-19 vaccine.,3395,11697,117143
1323285487059042309,2020-11-02 15:27:00+00:00,1 day. Let’s win this thing.,13980,70049,592808
1323281209267527680,2020-11-02 15:10:00+00:00,From climate change to racial justice — there is so much on the line in this election. So my team put together a generator to help you show your friends and family what you’re voting for. Head to https://t.co/kdc4aQ0d2D to try it out.,1324,1617,10391
1323273910981451778,2020-11-02 14:41:00+00:00,"If you can still vote early, then vote early today.

If you haven’t returned your absentee ballot yet, then return it today.

If you’re voting in-person tomorrow, then make your plan today.

Let’s end this — today.",4040,26529,198138
1323267619416399872,2020-11-02 14:16:00+00:00,"My faith has been my anchor through highs and lows –– a guiding light that taught me the values of honesty, decency, and treating others with respect.

As president, it will continue to serve as a source of strength. https://t.co/wIVS8Uga2d",4727,4711,28871
1323262197573836805,2020-11-02 13:54:27+00:00,"Don’t wait: Drop off your ballot today.

https://t.co/eoxT07d7QB",1563,5632,46376
1323256294925455360,2020-11-02 13:31:00+00:00,We need a president who actually listens to experts like Dr. Fauci.,9748,26218,293922
1323252268481695744,2020-11-02 13:15:00+00:00,"If I have the honor of being elected president, I will take care of your family like I would my own. https://t.co/MsIORKeVTF",7180,7202,50427
1323244215187447814,2020-11-02 12:43:00+00:00,"I started this campaign saying we were in a battle for the soul of this nation — and I believe that even more deeply today.

But make no mistake: It’s a battle we can and will win.",2866,8822,80795
1323238930339287045,2020-11-02 12:22:00+00:00,"Our president has failed in his most basic duty to this nation: to protect us.

It’s unforgivable.",4347,16642,157777
1323233897694470144,2020-11-02 12:02:00+00:00,"The hard truth is that our economy wasn't working for folks long before this crisis. It's why we can't just go back to the way things were — we have to build back better.

Here's how we'll do it: https://t.co/rt5RD9Fdi0",1143,1973,13187
1323228219127046144,2020-11-02 11:39:26+00:00,"Vote for respect.
Vote for decency.
Vote for truth.
Vote for leadership.

https://t.co/eoxT07d7QB",4464,14013,113762
1323136505435561985,2020-11-02 05:35:00+00:00,"When you use your voice and vote, things can — and will — change for the better. https://t.co/eoxT07d7QB",2154,2625,20100
1323128955642253312,2020-11-02 05:05:00+00:00,"Donald Trump sees the world from Park Avenue.

I see it from where I came from: Scranton, Pennsylvania. 

It's why I'll fight every day as president to make this country work for middle class and low-income Americans — not just the wealthy and well-connected.",7160,8515,81919
1323122502751653888,2020-11-02 04:39:21+00:00,"No one fights harder for the people of Alabama than my friend, @DougJones. He's a Senator with a big heart and he's never afraid to fight for what's right.

Doug is in a tight race and needs your help to win on Tuesday. Chip in: https://t.co/jwBbBDNZfH https://t.co/6kOEbMS4Pn",952,4390,26810
1323117631033933825,2020-11-02 04:20:00+00:00,"As president, I’ll protect and build on Obamacare by: 

- Giving Americans the choice of a new public option
- Lowering premiums, deductibles, and co-pays
- Lowering the cost of prescription drugs

Learn more: https://t.co/uw7Kk0ONHA",1681,2324,15518
1323112598938767361,2020-11-02 04:00:00+00:00,"The United States of America has emerged stronger from every trial and tribulation it has faced. And if we come together, follow the science, and keep faith with each other, we will once again. I promise.",1978,7687,66434
1323105048075792385,2020-11-02 03:30:00+00:00,"This is the most important election in our lifetimes — and you have the power to make all the difference.

Vote. https://t.co/eoxT07uII9",1954,2966,21996
1323098757173448704,2020-11-02 03:05:00+00:00,"2016 taught us to take nothing for granted and to leave everything on the field.

Vote: https://t.co/eoxT07uII9 https://t.co/q4yiDddE2s",1287,4311,21504
1323096239970373638,2020-11-02 02:55:00+00:00,"When Donald Trump thinks about climate change, he thinks “hoax.” 

I think “jobs.”

We can solve our climate crisis and our economic crisis at the same time. Here’s how: https://t.co/AKl9jZKB0s",1512,3631,25123
1323087935411924993,2020-11-02 02:22:00+00:00,"This is our moment to root out systemic racism and build a nation true to our founding ideals. A nation where all men and women are not only created equal — but treated equally. 

Here's how we'll advance racial economic equity: https://t.co/Tjgyn1gR2V",2133,2442,14638
1323082401774329856,2020-11-02 02:00:00+00:00,"A more hopeful, united, and loving America is within our grasp –– but we have to vote for it.

https://t.co/eoxT07uII9 https://t.co/cxmNP5SKpH",1780,2725,16994
1323077868990193672,2020-11-02 01:42:00+00:00,Donald Trump’s COVID-19 response has been the greatest failure of presidential leadership in our nation’s history.,4811,20189,175064
1323073590749614080,2020-11-02 01:25:00+00:00,From Arizona to Georgia to Wisconsin and beyond — we’re working hard to earn every last vote. https://t.co/mmfZspnLOU,2154,3642,38156
1323069815880327173,2020-11-02 01:10:00+00:00,"Under my tax plan, no one making under $400,000 will see their taxes go up.

But it’s time large corporations and the wealthiest Americans pay their fair share.",6601,17748,135520
1323062266200264705,2020-11-02 00:40:00+00:00,"I want to help restore hope in this country — and I have a bold vision for how, together, we can do that. https://t.co/ZdW23fhad2",2074,2458,16574
1323057366510817284,2020-11-02 00:20:32+00:00,"Together, we can make Donald Trump a one-term president.

https://t.co/eoxT07d7QB",4954,9672,98377
1323052200814366720,2020-11-02 00:00:00+00:00,"Donald Trump is trying to eliminate the entire Affordable Care Act in the middle of a pandemic.

If he gets his way, more than 100 million Americans with pre-existing conditions could see their costs skyrocket or be denied coverage altogether.

We can’t let him win. https://t.co/DoTV2uw1bn",1409,3733,16426
1323048424929898501,2020-11-01 23:45:00+00:00,It’s long past time President Trump and his wealthy friends paid their fair share in taxes.,7358,13026,129702
1323043391840481280,2020-11-01 23:25:00+00:00,"Scranton, Pennsylvania, isn't just where I'm from — it's the people I'm for. I'll fight every single day in the White House for the hardworking Americans who make our country run. https://t.co/vahd9rc1Ja",1650,4228,24859
1323030495630798848,2020-11-01 22:33:45+00:00,"Together, we can solve the crises we’re facing and win the battle for the soul of the nation. It all begins on Tuesday. Tune in as we get out the vote in Pennsylvania. https://t.co/cOqA9eN3LA",1272,2204,12473
1323023259512659968,2020-11-01 22:05:00+00:00,"Let's turn Texas blue.

https://t.co/COWdd5hED8 https://t.co/TPNH6BKXGd",3896,13461,93850
1323018225895047179,2020-11-01 21:45:00+00:00,"Donald Trump claimed he would be ""the greatest jobs president God ever created.""

Instead, he's on track to become the worst jobs president in 100 years.",4410,13702,102368
1323013947973197824,2020-11-01 21:28:00+00:00,"Don’t let anyone tell you your voice won’t count — because it will.

Make sure your voice is heard. Go to https://t.co/uoiVh9HPb8 right now and make your plan to vote.",1500,3177,18657
1323002402534928384,2020-11-01 20:42:07+00:00,Tune in as I join members of Philadelphia's faith community for a Souls to the Polls event. https://t.co/9i6yGiETvt,1233,1837,11275
1322989285377667073,2020-11-01 19:50:00+00:00,"I believe climate change is an existential threat to humanity.

Donald Trump doesn’t even think it exists.

It’s that simple, folks.",4546,16131,143909
1322981735739645953,2020-11-01 19:20:00+00:00,Fired up! https://t.co/fqFCBvwudr,4226,15767,203533
1322976702419636225,2020-11-01 19:00:00+00:00,"It’s long past time we take action to end the scourge of gun violence in America.

As president, I’ll ban assault weapons and high-capacity magazines, implement universal background checks, and enact other common-sense reforms to end our gun violence epidemic.",14248,8613,68129
1322971669355483139,2020-11-01 18:40:00+00:00,"More than 230,000 Americans have died from COVID-19 –– and Donald Trump has given up on trying to get the virus under control.

He may have quit on you, but I promise I never will.",2852,8695,66722
1322967642777550858,2020-11-01 18:24:00+00:00,"There are just two days until Election Day, and our campaign is working around the clock to get folks to vote.

Can you chip in to help us reach every last voter before polls close on Tuesday? https://t.co/owL20qONri",1483,1432,9311
1322963112857800705,2020-11-01 18:06:00+00:00,"Health care is deeply personal to me — like it is for so many Americans. And I promise you that as president, I will protect your family's health care as if it were my own. https://t.co/v6fLWHoRC7",1386,3917,22531
1322959086544211973,2020-11-01 17:50:00+00:00,"We can build a future where:

- Health care is a right
- We end the gun violence epidemic
- We combat climate change
- Our government works for everyone

Vote. https://t.co/eoxT07d7QB",1381,2465,17551
1322952795033538560,2020-11-01 17:25:00+00:00,"The Trump Administration knew how deadly this virus was back in February.

But they didn't tell you or your family. Instead, they gave a heads up to their friends on Wall Street so investors could make a profit before the recession hit.

They hid the truth. It's unforgivable.",2783,9064,49297
1322949020164202497,2020-11-01 17:10:00+00:00,"I'm running as a proud Democrat, but I will govern as an American president. https://t.co/d5tmoNSnco",1838,4783,35088
1322943986995179522,2020-11-01 16:50:00+00:00,We need a president who believes in science and listens to someone other than himself.,5603,23824,238251
1322937695606362118,2020-11-01 16:25:00+00:00,"Folks, there are just three days left to vote in this election, and we need your help to get people to the polls. Text three friends or family members and make sure they have a plan to vote. https://t.co/xu4mk3W5x2",2345,4414,30921
1322932159447924737,2020-11-01 16:03:00+00:00,"Desde sus actos atroces con la separación de familias en nuestra frontera hasta su ignorancia con el pueblo puertorriqeño después del huracán María, el presidente Trump ha atacado la dignidad de las familias latinas una y otra vez.

Esto terminará cuando yo sea presidente.",2267,4261,28890
1322927509260902401,2020-11-01 15:44:31+00:00,"The future of our planet is on the ballot.

Vote: https://t.co/eoxT07d7QB",1865,4324,42405
1322922596195684353,2020-11-01 15:25:00+00:00,"If you’re sick or struggling or worried about how you’ll get through the day: I want you to know that I see you, and I won’t forget you.

You can count on me to fight for you every day in the White House.",3016,7931,69816
1322918821242556425,2020-11-01 15:10:00+00:00,"From his heinous acts of separating families at our border to his neglect of the people of Puerto Rico after Hurricane Maria, President Trump has attacked the dignity of Latino families time and time again.

It will end when I’m president.",2567,6886,47216
1322914542892929024,2020-11-01 14:53:00+00:00,2 days. Finish strong.,7398,21876,261483
1322907244871102464,2020-11-01 14:24:00+00:00,I promise you this: I’ll end Donald Trump’s chaos and end this crisis.,13954,26989,280998
1322901204943491073,2020-11-01 14:00:00+00:00,"My faith has been a source of immeasurable solace in times of grief and a daily inspiration to fight against the abuse of power in all its forms. As president, it will continue to serve as my anchor, as it has my entire life. https://t.co/C5OqUaJKWd",4433,5025,33591
1322896675040456704,2020-11-01 13:42:00+00:00,"Right now:
 
- Almost 23 million Americans are on unemployment
- Nearly 1 in 5 small businesses have closed their doors
- Millions of people are at risk of being evicted
 
We simply can’t afford another four years of Donald Trump.",4798,8552,52322
1322892363350577154,2020-11-01 13:24:52+00:00,"Return your ballot today, folks.

https://t.co/eoxT07d7QB",1319,4968,42702
1322886357535150081,2020-11-01 13:01:00+00:00,Jodie –– you have my word: I will always stand up for you and the millions of Americans with pre-existing conditions. https://t.co/p7VxJVFf9G,934,2776,19379
1322881072363917312,2020-11-01 12:40:00+00:00,"We need to:

Build bridges, not walls.
Open our arms, not clench our fists.
Focus on the ties that bind us together, not tear each other apart.

We need to be what we are at our best: One America.",3057,10360,84254
1322876039144636417,2020-11-01 12:20:00+00:00,"We have in our hands the ultimate power: the power of the vote.

Don’t let it go to waste. Make your plan to vote today. https://t.co/uoiVh9ZqzI",1983,2773,18064
1322871257902145536,2020-11-01 12:01:00+00:00,Let’s put dogs back in the White House. https://t.co/7pBihksfXT,5866,15828,134428
1322865972819251200,2020-11-01 11:40:00+00:00,"As president, I’ll build an economy that rewards work — not just wealth.",7847,10999,124345
1322757759591436288,2020-11-01 04:30:00+00:00,Vote like your health care is on the ballot — because it is. https://t.co/eoxT07d7QB,1991,3464,26216
1322751468827541510,2020-11-01 04:05:00+00:00,"The issues we’re facing are far bigger than any political party.

It’s why I’ll be a president for all Americans — Democrats, Republicans, and Independents alike — because I believe we must work together if we’re going to get anything done.",2461,5905,47501
1322746435071139840,2020-11-01 03:45:00+00:00,".@BarackObama and I have seen the office of the presidency up close, we know what the job entails, and there's too much at stake to give Donald Trump another four years.

Vote: https://t.co/eoxT07uII9 https://t.co/7imuWqlZSN",2422,3839,31631
1322740143741005825,2020-11-01 03:20:00+00:00,"The words of a president matter. And time and time again, Donald Trump has callously used his to incite violence, stoke the flames of hatred and division, and drive us further apart.

It’s time for it to end.",4717,16202,111671
1322735117387943939,2020-11-01 03:00:01+00:00,"To all the heroes who have served in our armed forces, and the families and caregivers who sacrificed alongside them, I promise I’ll always have your back. https://t.co/TrvHFeMHK1",1702,4553,31182
1322730450293587968,2020-11-01 02:41:29+00:00,"The character of our nation is on the ballot.

Vote: https://t.co/eoxT07d7QB",5636,4628,41291
1322725547504328704,2020-11-01 02:22:00+00:00,We can and will solve the climate crisis — together. https://t.co/3KbdJ5s5Z6,1199,2979,18069
1322721017811345410,2020-11-01 02:04:00+00:00,"The hard truth is that under President Trump, we’ve become weaker, sicker, poorer, more divided, and more violent.",7156,28729,218833
1322714977715785729,2020-11-01 01:40:00+00:00,"Un número récord de latinos son elegibles para votar en esta elección, así que ve a votar para lograr que tu voz se escuche. No dejes que los demás decidan por ti.

https://t.co/eeAbclJjDY https://t.co/vOsq6xw2eX",967,1967,10164
1322709944509124613,2020-11-01 01:20:00+00:00,"Together, we can end the last four years of chaos.

https://t.co/eoxT07d7QB https://t.co/V2EMJnkqSC",2367,3632,17396
1322705178622070784,2020-11-01 01:01:03+00:00,"Vote for equality.
Vote for the planet.
Vote for justice.
Vote for the future.
 
https://t.co/eoxT07d7QB",6059,9529,72873
1322699878196301832,2020-11-01 00:40:00+00:00,"You’re absolutely right, Brayden — no one should ever underestimate the American people. https://t.co/aCsdIWmF62",1334,6105,32170
1322695600106659840,2020-11-01 00:23:00+00:00,President Trump doesn’t care about you. He doesn’t even care about his own supporters. https://t.co/HUbImXyRtY,4468,18257,83996
1322692328591552512,2020-11-01 00:10:00+00:00,"Tonight marks our last end-of-month fundraising deadline — and it’s our most important one yet.

With three days until Election Day, we can’t afford to fall short.

If you’re able, please chip in to help us reach our goal: https://t.co/avjGKglNpD",1234,1115,6973
1322688553650827264,2020-10-31 23:55:00+00:00,Happy Halloween! https://t.co/i2BT7k0xdI,1575,5303,84358
1322685282165026817,2020-10-31 23:42:00+00:00,"I want to extend my prayers and condolences to the Chaldean Assyrian Community this 10th anniversary of Our Lady of Deliverance church massacre in Baghdad. The right to worship is fundamental, and as Americans we should be proud that people from around the world find a home here.",1170,3922,38242
1322679745662881798,2020-10-31 23:20:00+00:00,"Presidents lead by example.

Mask up. https://t.co/eSvTmjmaYK",4185,19187,210683
1322646873081966593,2020-10-31 21:09:22+00:00,"There is too much at stake on Tuesday to sit this election out. Tune in as @BarackObama, @StevieWonder, and I get out the vote in Detroit, Michigan. https://t.co/ihywYiR6lc",1838,2421,13539
1322640738648313856,2020-10-31 20:45:00+00:00,"As president, I will choose: 

Hope, not fear.
Peace, not violence.
Generosity, not greed.
 
I’ll appeal to the best in us, not the worst.",5965,16599,148542
1322631427297476608,2020-10-31 20:08:00+00:00,".@BarackObama already voted, but he knows there's still more work to be done before Election Day.

Sign up to join him: https://t.co/UIiNehABm6 https://t.co/8qgmrxEDny",1893,3634,25042
1322620606098137088,2020-10-31 19:25:00+00:00,President Obama and I left President Trump a playbook on how to deal with pandemics. He flat-out ignored it. And we're suffering every day because of it.,8943,24143,173637
1322613559491284994,2020-10-31 18:57:00+00:00,"If you’re planning to vote early in-person, today is your last day to do so in many states. Head to https://t.co/eoxT07d7QB to find all the information you need to cast your ballot. https://t.co/CL7abyUo5p",948,2881,12080
1322598107809394689,2020-10-31 17:55:36+00:00,"With just three days to go, @BarackObama and I are back together on the campaign trail in Michigan. Tune in. https://t.co/8jqYUvbTz9",2564,3084,18421
1322585061452034048,2020-10-31 17:03:45+00:00,"Folks, we’re just three days from Election Day — and what you do between now and when polls close on Tuesday will determine the course of our country for generations to come. 

Sign up to help us get voters to the polls: https://t.co/WSKsQEip4U",1671,3542,24947
1322569017412997122,2020-10-31 16:00:00+00:00,Who let all these people into my basement? https://t.co/E17SPqmXib,19339,69169,487416
1322561466357211136,2020-10-31 15:30:00+00:00,"3 days.

Stay empowered, stay optimistic, stay united.",6528,22095,214012
1322551400191135744,2020-10-31 14:50:00+00:00,"The urgency of this election couldn’t be greater — and the stakes couldn’t be higher. 

Don’t wait: go to https://t.co/eoxT07d7QB and vote early today.",2017,2361,14449
1322543347236438016,2020-10-31 14:18:00+00:00,Be a patriot. Wear a mask. https://t.co/o2v9xP24A9,8320,11642,91206
1322531268152729601,2020-10-31 13:30:00+00:00,"Every single American deserves access to regular, reliable, and free COVID-19 testing. Period.",3563,12389,130204
1322519943167021056,2020-10-31 12:45:00+00:00,"President Trump still has no plan to address COVID-19.

He quit on you, on your family, on America. He just wants us to grow numb to the horrors of the death toll and the pain.

We cannot afford another four years of his failed leadership.",5321,17298,117120
1322512392937525249,2020-10-31 12:15:00+00:00,"The future of this country is in your hands.

Make a plan to vote now. https://t.co/uoiVh9ZqzI",1622,3207,22260
1322504843244744704,2020-10-31 11:45:00+00:00,"I believe every American deserves to retire with dignity.

https://t.co/mVwdWJ1owh https://t.co/iyekmiUqvP",1588,4037,24560
1322493526878253057,2020-10-31 11:00:02+00:00,"This is your chance to be a part of history.

Vote: https://t.co/eoxT07uII9 https://t.co/4bH8iawiSE",1321,2951,18191
